序号,题目（含完整选项）,答案
73,下列关于育种方法的叙述，正确的是（  ） A. 多倍体育种常用秋水仙素处理萌发的种子或幼苗，使染色体数目加倍 B. 单倍体育种过程中，通过花药离体培养获得的单倍体植株都能表现出优良性状 C. 诱变育种可以提高突变率，在较短时间内获得更多的优良变异类型，且能定向改造生物性状 D. 杂交育种只能在同种生物中进行，通过基因重组将多个优良性状集中在一起,A
74,下列有关生物进化的叙述，错误的是（  ） A. 生物进化的实质是种群基因频率在自然选择作用下的定向改变 B. 生物进化过程中，种群基因库中基因频率的变化只与自然选择有关 C. 新物种形成的标志是出现生殖隔离 D. 隔离是物种形成的必要条件，包括地理隔离和生殖隔离,B
75,下列关于内环境稳态调节机制的叙述，错误的是（  ） A. 内环境稳态的维持主要依赖神经调节、体液调节和免疫调节的共同作用 B. 神经调节的基本方式是反射，完成反射的结构基础是反射弧 C. 体液调节主要是激素等化学物质通过体液传送的方式对生命活动进行调节 D. 免疫调节在维持内环境稳态中不起作用,D
76,下列关于兴奋传导的叙述，正确的是（  ） A. 神经纤维膜内局部电流的流动方向与兴奋传导方向一致 B. 神经纤维上已兴奋的部位将恢复为静息状态的零电位 C. 突触小体完成“化学信号—电信号”的转变 D. 神经递质作用于突触后膜，使突触后膜产生兴奋,A
77,下列关于激素的叙述，错误的是（  ） A. 激素既不组成细胞结构，又不提供能量，也不起催化作用 B. 激素随体液到达靶细胞，使靶细胞原有的生理活动发生变化 C. 促甲状腺激素释放激素和甲状腺激素对垂体的调节表现为协同作用 D. 激素调节是体液调节的主要内容,C
78,下列关于免疫细胞的叙述，正确的是（  ） A. 吞噬细胞只在非特异性免疫中发挥作用 B. T细胞和B细胞都起源于骨髓中的造血干细胞 C. 浆细胞能特异性识别抗原并分泌抗体 D. 效应T细胞能与靶细胞密切接触并直接吞噬靶细胞,B
79,下列关于植物激素调节的叙述，正确的是（  ） A. 植物激素的化学本质都是蛋白质 B. 植物激素直接参与细胞内的代谢活动 C. 植物激素在植物体内含量很少，但具有高效性 D. 植物激素的作用都具有两重性,C
80,下列关于种群数量特征的叙述，正确的是（  ） A. 种群密度能反映种群在一定时期的数量和数量变化趋势 B. 出生率和死亡率、迁入率和迁出率决定种群密度的大小 C. 年龄组成和性别比例直接影响种群密度的变化 D. 年龄组成只有增长型和衰退型两种类型,B
81,下列关于群落演替的叙述，正确的是（  ） A. 群落演替的过程中，物种丰富度不断增加 B. 初生演替和次生演替的主要区别在于起始条件不同 C. 群落演替的最终阶段都是森林阶段 D. 人类活动对群落演替没有影响,B
82,下列关于生态系统的叙述，正确的是（  ） A. 生态系统的结构包括生态系统的组成成分和营养结构 B. 生态系统的能量流动是指能量的输入和散失过程 C. 生态系统的物质循环是指各种化合物在生物群落和无机环境之间的循环过程 D. 生态系统的信息传递只能发生在生物与生物之间,A
83,下列关于生态系统能量流动的叙述，错误的是（  ） A. 能量流动是单向的、不循环的 B. 能量在流动过程中逐级递减 C. 生产者固定的太阳能是流经生态系统的总能量 D. 初级消费者越多，次级消费者获得的能量越少,D
84,下列关于生态系统物质循环的叙述，正确的是（  ） A. 物质循环具有全球性，又叫生物地球化学循环 B. 碳在生物群落与无机环境之间的循环主要以碳酸盐的形式进行 C. 物质循环与能量流动彼此独立，互不相关 D. 物质循环在生产者、消费者和分解者之间循环往复,A
85,下列关于生态系统信息传递的叙述，正确的是（  ） A. 生态系统中的信息传递对所有捕食者都必然有利 B. 信息传递能够调节生物的种间关系，以维持生态系统的稳定 C. 生态系统中的物理信息只能来自无机环境 D. 生物种群的繁衍离不开化学信息的传递,B
86,下列关于生态系统稳定性的叙述，正确的是（  ） A. 生态系统的稳定性是指生态系统保持相对稳定的状态，不发生变化 B. 抵抗力稳定性高的生态系统，恢复力稳定性也一定高 C. 生态系统的自我调节能力是有限的，当外界干扰因素的强度超过一定限度时，生态系统的稳定性就会遭到破坏 D. 增加生态系统内各营养级生物的种类不能提高生态系统的稳定性,C
87,下列关于细胞结构和功能的叙述，错误的是（  ） A. 线粒体是细胞进行有氧呼吸的主要场所，能为细胞生命活动提供能量 B. 叶绿体是植物进行光合作用的细胞器，能将光能转化为化学能 C. 溶酶体含有多种水解酶，能分解衰老、损伤的细胞器，吞噬并杀死侵入细胞的病毒或细菌 D. 核糖体是蛋白质合成的场所，由蛋白质和DNA组成,D
88,下列关于细胞中化合物的叙述，错误的是（  ） A. 蛋白质是生命活动的主要承担者，其基本组成单位是氨基酸 B. DNA是细胞中的遗传物质，其基本组成单位是脱氧核苷酸 C. 糖类是细胞中的主要能源物质，所有糖类都能被细胞直接吸收利用 D. 脂质包括脂肪、磷脂和固醇等，对维持细胞的结构和功能有重要作用,C
89,下列关于物质跨膜运输的叙述，错误的是（  ） A. 主动运输需要载体蛋白和能量，能逆浓度梯度运输物质 B. 协助扩散不需要能量，但需要载体蛋白，只能顺浓度梯度运输物质 C. 自由扩散不需要载体蛋白和能量，只能顺浓度梯度运输物质 D. 细胞通过主动运输方式吸收离子的速率与细胞呼吸强度始终呈正相关,D
90,下列关于酶的叙述，正确的是（  ） A. 酶在催化反应完成后立即被降解成氨基酸 B. 酶的活性与温度、pH有关，与底物浓度无关 C. 酶在细胞内和细胞外都能发挥作用 D. 一种酶只能催化一种化学反应,C
91,下列关于细胞呼吸的叙述，错误的是（  ） A. 细胞呼吸是指有机物在细胞内经过一系列的氧化分解，生成二氧化碳或其他产物，释放出能量并生成ATP的过程 B. 有氧呼吸和无氧呼吸的第一阶段都在细胞质基质中进行，且都能产生少量ATP C. 有氧呼吸的第二、三阶段在线粒体中进行，产生大量ATP D. 人体细胞无氧呼吸的产物是酒精和二氧化碳,D
92,下列关于光合作用的叙述，错误的是（  ） A. 光合作用的光反应阶段和暗反应阶段都需要光 B. 光反应阶段产生的ATP和[H]为暗反应阶段提供能量和还原剂 C. 暗反应阶段发生在叶绿体基质中，能将二氧化碳固定并还原成糖类等有机物 D. 光合作用的实质是将光能转化为化学能，储存在有机物中,A
93,下列关于细胞增殖、分化、衰老和凋亡的叙述，错误的是（  ） A. 细胞增殖是生物体生长、发育、繁殖和遗传的基础 B. 细胞分化使细胞的形态、结构和功能发生稳定性差异，是基因选择性表达的结果 C. 细胞衰老过程中，细胞内所有酶的活性都降低 D. 细胞凋亡是由基因决定的细胞自动结束生命的过程，对生物体有利,C
94,下列关于遗传物质的叙述，错误的是（  ） A. 真核生物和原核生物的遗传物质都是DNA B. 病毒的遗传物质是DNA或RNA C. 噬菌体侵染细菌的实验证明了DNA是主要的遗传物质 D. 烟草花叶病毒的感染和重建实验证明了RNA是遗传物质,C
95,下列关于基因表达的叙述，正确的是（  ） A. 转录过程中，RNA聚合酶与DNA模板链上的起始密码子结合开始转录 B. 翻译过程中，一种氨基酸只能由一种tRNA转运 C. 基因表达过程中，遗传信息的传递方向是DNA→RNA→蛋白质 D. 转录和翻译过程都发生在细胞核中,C
96,下列关于生物变异的叙述，错误的是（  ） A. 基因突变能产生新基因，是生物变异的根本来源 B. 基因重组发生在减数分裂过程中，能产生新的基因型 C. 染色体结构变异会使排列在染色体上的基因的数目或排列顺序发生改变 D. 单倍体生物的体细胞中一定只含有一个染色体组,D
97,下列关于人类遗传病的叙述，错误的是（  ） A. 人类遗传病分为单基因遗传病、多基因遗传病和染色体异常遗传病 B. 调查人类遗传病的发病率应在人群中随机抽样调查 C. 遗传咨询和产前诊断等手段不能对遗传病进行监测和预防 D. 猫叫综合征是由染色体结构变异引起的,C
98,下列关于育种的叙述，错误的是（  ） A. 杂交育种的原理是基因重组，能将多个优良性状集中到一个个体上 B. 诱变育种的原理是基因突变，能提高突变率，在较短时间内获得更多的优良变异类型 C. 单倍体育种的原理是染色体变异，能明显缩短育种年限 D. 多倍体育种得到的个体都能表现出优良性状,D
99,下列关于生物进化的叙述，错误的是（  ） A. 自然选择决定生物进化的方向 B. 生物进化的实质是种群基因频率的改变 C. 隔离是物种形成的必要条件 D. 生物进化的过程中，种群基因库中基因频率的变化只与自然选择有关,D
100,下列关于生态系统的叙述，错误的是（  ） A. 生态系统的结构包括生态系统的组成成分和营养结构 B. 生态系统的能量流动是单向的、逐级递减的 C. 生态系统的物质循环具有全球性和循环性 D. 生态系统的信息传递只能调节生物的种间关系,D
